10.01.2016 8:34:00,"Актобе каласынан жер сатамын дача 8,8 соток горэлектросеть 9 стары часть казмунайгаз заправкасынын астынгы жагында 1,800,000 тг тел:87774349469 алам деушилерге багасы келисимди. Админ отиниш шыгарып жиберши!",http://vk.com/wall-86357428_53700
10.01.2016 8:02:00,#fcnurlybekkadyrov  #астана  #pavlodar  #uralsk  #karaganda  #astanaopera  #nurlybekkadyrov  #kazakhstan  #almaty  #aktau  #aktaucity  #petropavlovsk  #expo2017  #taldykorgan  #astana  #atyrau  #mangystau  #baykonur  #akko  #upiter  #bulgari  #semey  #казмунайгаз  #kyzylorda  #kostanay  #aktobe  #taraz??????...,https://www.instagram.com/p/BASeSLTjkrd/#1159155657531607392
10.01.2016 4:15:00,"Вниманию участников и болельщиков представляются результаты матчей 2-го круга 9-го Чемпионата г. Усть-Каменогорск и ВКО по футзалу 2015-2016 г., состоявшихся в субботу, 9 января:  Пристань – Алтайэнерго 2:2  Достар – Адилет 3:8  Маркаколь – Риддер 2:4  Востокцветмет – УМЗ-Торпедо 2:1  Абайский р-он – Казмунайгаз 4:7  БГП – Кайрат 2:8  ДЧС – Абайский р-он 6:3  НИШ – Винсборн 3:11",http://vk.com/wall-101646515_305
10.01.2016 1:56:00,"Золотовалютные резервы Казахстана иссякнут к 2026 годуЗолотовалютные... резервы Казахстана в объеме $64,2 млрд стали последней жертвой низких цен на нефть и, по прогнозам, полностью иссякнут к 2026 году.   Находящиеся под управлением Национального фонда Республики Казахстан активы, которые в значительной степени зависят от нефти и от которых зависит экономика страны, всего за 18 месяцев упали на 16 процентов, до $64.2 млрд. За тот же период, цена на нефть упала со $115 до $33 за баррель.   Поскольку цена на нефть упала, государственные фонды по всему миру довольно быстро начали вытягивать деньги от управляющих активами. Согласно eVestment, в течение третьего квартала 2015 года государственными учреждениями было снято $19 млрд, что в итоге сократило прибыль инвестиционных менеджеров.   Казахский фонд, который был создан в 2000 году и финансируется за счет налогов и отчислений сырьевой отрасли не раскрывает своих внешних управляющих, но около трети его активов, как полагают, находятся в ведении зарубежных инвестиционных организаций. Остальные, в основном, инвестируют в суверенные облигации.   Согласно попавшим в руки Financial Times документам должностных лиц Национального банка Республики Казахстан, Национальный фонд будет исчерпан в течение 10 лет, если цены на нефть останутся на низком уровне, а правительство продолжит снимать наличные, дабы поддержать экономику борющейся страны.   Берик Отемурат, председатель правления АО ""Национальная инвестиционная корпорация Национального банка"", который был создан для диверсификации инвестиционного подхода банка, сказал: ""Падение активов в Национальном фонде является очень серьезной проблемой для страны. Очень важно, чтобы правительство приняло меры по этому вопросу и сделало что-то, чтобы предотвратить истощение фонда"".   Руководство Национального банка Республики Казахстан, который непосредственно несет ответственность за фонд, от комментариев отказалось. В настоящее время банк находится в процессе реорганизации, после смены руководства в ноябре месяце прошлого года. Отемурат считает, что его работа находится под угрозой.   Правительство Казахстана, заявившее о планах вывести $28.8 млрд из Национального фонда в течение ближайших трех лет, не откликнулось на просьбу о комментариях.   Казахстан, находящийся на 18-ом месте в списке крупнейших мировых производителей нефти, сильно пострадал от падения цен на сырьевые товары. Президент страны Нурсултан Назарбаев предупредил, что в прошлом году страна столкнулась с ""реальным кризисом"", так как доходы государства Центральной Азии упали на 40 процентов....   Страна приступает к амбициозному плану приватизации, предлагая доли в крупнейших государственных предприятиях международным инвесторам в попытках поддержать свой баланс.   АО ""ФНБ ""Самрук - Казына"" планирует продать нефтегазовую компанию ""КазМунайГаз"" и крупнейшую телекоммуникационную компанию ""Казахтелеком"", а также ряд других предприятий....   Человек, знакомый с ситуацией в Казахстане, согласившийся говорить только на условиях анонимности, сообщил: ""Национальный фонд был создана в качестве средства на черный день. Вполне нормально, когда активы фонда увеличиваются в хороший день, и истощаются в плохой"".   BlackRock, Franklin Resources, Invesco, Aberdeen и отделения американских банков State Street, JPMorgan и Goldman Sachs зафиксировали большие оттоки из национальных фондов в прошлом году.   Отток, как ожидается, продолжится и в 2016 году. Старший кредитор рейтингового агентства Moody's Роберт Келледжей, заявил: ""Уверенные в своих ресурсах страны будут подвергаться нарастающему давлению. Им придется использовать активы национального фонда, чтобы залатать бюджетный дефицит и поддержать внутреннюю экономику. Это приведет к дальнейшему откату из национальных фондов..."".",http://segodnya24.ru/zolotovalyutnye-rezervy-kazaxstana-issyaknut-k-2026-godu/
10.01.2016 0:24:00,у Нас седня КазМунайГаз с молотка продали в частные руки,http://vk.com/wall254643185_54801
09.01.2016 23:49:00,"Золотовалютные резервы Казахстана иссякнут к 2026 годуЗолотовалютные... резервы Казахстана в объеме $64,2 млрд стали последней жертвой низких цен на нефть и, по прогнозам, полностью иссякнут к 2026 году.   Находящиеся под управлением Национального фонда Республики Казахстан активы, которые в значительной степени зависят от нефти и от которых зависит экономика страны, всего за 18 месяцев упали на 16 процентов, до $64.2 млрд. За тот же период, цена на нефть упала со $115 до $33 за баррель.   Поскольку цена на нефть упала, государственные фонды по всему миру довольно быстро начали вытягивать деньги от управляющих активами. Согласно eVestment, в течение третьего квартала 2015 года государственными учреждениями было снято $19 млрд, что в итоге сократило прибыль инвестиционных менеджеров.   Казахский фонд, который был создан в 2000 году и финансируется за счет налогов и отчислений сырьевой отрасли не раскрывает своих внешних управляющих, но около трети его активов, как полагают, находятся в ведении зарубежных инвестиционных организаций. Остальные, в основном, инвестируют в суверенные облигации.   Согласно попавшим в руки Financial Times документам должностных лиц Национального банка Республики Казахстан, Национальный фонд будет исчерпан в течение 10 лет, если цены на нефть останутся на низком уровне, а правительство продолжит снимать наличные, дабы поддержать экономику борющейся страны.   Берик Отемурат, председатель правления АО ""Национальная инвестиционная корпорация Национального банка"", который был создан для диверсификации инвестиционного подхода банка, сказал: ""Падение активов в Национальном фонде является очень серьезной проблемой для страны. Очень важно, чтобы правительство приняло меры по этому вопросу и сделало что-то, чтобы предотвратить истощение фонда"".   Руководство Национального банка Республики Казахстан, который непосредственно несет ответственность за фонд, от комментариев отказалось. В настоящее время банк находится в процессе реорганизации, после смены руководства в ноябре месяце прошлого года. Отемурат считает, что его работа находится под угрозой.   Правительство Казахстана, заявившее о планах вывести $28.8 млрд из Национального фонда в течение ближайших трех лет, не откликнулось на просьбу о комментариях.   Казахстан, находящийся на 18-ом месте в списке крупнейших мировых производителей нефти, сильно пострадал от падения цен на сырьевые товары. Президент страны Нурсултан Назарбаев предупредил, что в прошлом году страна столкнулась с ""реальным кризисом"", так как доходы государства Центральной Азии упали на 40 процентов....   Страна приступает к амбициозному плану приватизации, предлагая доли в крупнейших государственных предприятиях международным инвесторам в попытках поддержать свой баланс.   АО ""ФНБ ""Самрук - Казына"" планирует продать нефтегазовую компанию ""КазМунайГаз"" и крупнейшую телекоммуникационную компанию ""Казахтелеком"", а также ряд других предприятий....   Человек, знакомый с ситуацией в Казахстане, согласившийся говорить только на условиях анонимности, сообщил: ""Национальный фонд был создана в качестве средства на черный день. Вполне нормально, когда активы фонда увеличиваются в хороший день, и истощаются в плохой"".   BlackRock, Franklin Resources, Invesco, Aberdeen и отделения американских банков State Street, JPMorgan и Goldman Sachs зафиксировали большие оттоки из национальных фондов в прошлом году.   Отток, как ожидается, продолжится и в 2016 году. Старший кредитор рейтингового агентства Moody's Роберт Келледжей, заявил: ""Уверенные в своих ресурсах страны будут подвергаться нарастающему давлению. Им придется использовать активы национального фонда, чтобы залатать бюджетный дефицит и поддержать внутреннюю экономику. Это приведет к дальнейшему откату из национальных фондов..."".",http://maxpark.com/user/4297746542/content/4951398
09.01.2016 22:23:00,"#fcnurlybekkadyrov  #астана  #pavlodar  #uralsk  #karaganda  #astanaopera  #nurlybekkadyrov  #kazakhstan  #almaty  #aktau  #aktaucity  #petropavlovsk  #expo2017  #taldykorgan  #astana  #atyrau  #mangystau  #baykonur  #akko  #upiter  #bulgari  #semey  #казмунайгаз  #kyzylorda  #kostanay  #aktobe  #tarazНурлыбек Кадыров - яркий представитель отечественного музыкального искусства, выпускник Казахского национального университета искусств, Уникальность этого артиста в его виртуозном исполнении и профессионализме. В руках Нурлыбека игра на баяне обретает совершенно новый формат, а национальный колорит, который является изюминкой артиста, в современном исполнении звучит по новому. \nВ репертуаре имеются такие произведения как: \ Япурай\, \ Жайдарман\, \Бакыт кушагында\, \Камажай\, \Наз коныр\, \Аксиса\, \Ламбада\, \Шотландский ветер\, \Восток\, \Хе-ле-ле\, \Самба\, а так же попурри на зарубежные песни..",https://www.instagram.com/p/BAVHN7QjkrL/#1158864309104560772
09.01.2016 22:23:00,#fcnurlybekkadyrov  #астана  #pavlodar  #uralsk  #karaganda  #astanaopera  #nurlybekkadyrov  #kazakhstan  #almaty  #aktau  #aktaucity  #petropavlovsk  #expo2017  #taldykorgan  #astana  #atyrau  #mangystau  #baykonur  #akko  #upiter  #bulgari  #semey  #казмунайгаз  #kyzylorda  #kostanay  #aktobe  #taraz#Fcnurlybekkadyrov  #nurlybekkadyrov  #астана  #astanaOpera  #казМунайГаз  #kazakhstan  #expo2017  #akko  #bulgari  #upiter  #astana  #almaty  #kyzylorda  #baykonur  #aktobe  #uralsk  #taraz  #mangystau  #atyrau  #aktau  #aktaucity  #karaganda  #taldykorgan  #kostanay  #pavlodar  #petropavlovsk  #semey. По вопросам выступлений предложений и сотрудничества: ?? +7-775-338-24-94 ; Администратор Жанерке,https://www.instagram.com/p/BAVHN7QjkrL/
09.01.2016 21:36:00,"««Казахстан Темир Жолы», «КазМунайГаз», «Эйр Астана» уходят в частные руки | НовостиНациональные компании Казахстана уходят в частные руки. Более 50 крупных предприятий, среди которых «Казахстан Темир Жолы», «КазМунайГаз» и «Эйр Астана» вошли в список объектов приватизации, который сегодня обнародовало Министерство национальной экономики.  Массовую распродажу крупные государственные холдинги начали еще в конце прошлого года, однако полный список всех уходящих с молотка...",http://vk.com/wall335308174_9
09.01.2016 20:48:00,"Комплексный план приватизации утвержден в РК - 9 регион-доска бесплатных объявлений Интернет газета подать объявление КазахстанКомплексный... план приватизации утвержден в РК  Правительство Казахстана утвердило Комплексный план приватизации на 2016–2020 годы и целевые индикаторы реализации Комплексного плана  Планируется достичь следующих показателей:  1. Сокращение к 2021 году субъектов квазигосударственного сектора организаций республиканской собственности на 15%.  2. Передача в конкурентную среду организаций коммунальной собственности к общему количеству 5%.  В перечень компаний, подлежащих приватизации, вошли: «СК-Фармация», Казмедтех, «Қазақстан ғарыш сапары», Казгеология, Казахавтодор, Международный центр пограничного сотрудничества «Хоргос», Международный аэропорт Астана, «Парк ядерных технологий», санаторий «Алматы...», «Астана қонақ үйі», Казахтелеком, Qazaq Air, Аэропорт Павлодара, Международный аэропорт Актобе, Международный аэропорт Атырау, Актауский международный морской торговый порт.  Также указаны компании, реализация пакетов акций которых предусмотрена на IPO, в том числе: «Қазақстан Темiр Жолы», КазМунайГаз, Казатомпром, «Самрук-Энерго», Казпочта, «Эйр Астана...».  http://09region.kz/kompleksnyj-plan-privatizatsii-utverzhden-v-rk.../",http://vk.com/wall-94358000_5214
09.01.2016 20:05:00,"[[id116733167|Баяна], не, парни ведутся на грудь и жопу, красивое лицо и ровные ноги, а так же на папу в КазМунайГазе",http://vk.com/wall-61082678_20255
09.01.2016 18:36:00,"#KTK_news - «Казахстан Темир Жолы», «КазМунайГаз», «Эйр Астана» уходят в частные руки | Новости http://ktk.kz/ru/news/video/…",http://twitter.com/KaravanTour/status/685892887289040896
09.01.2016 18:17:00,"Керек болады  101 - Пожарная  102 - Полиция  103 - Скорая  104 - Аварийная (газ)  105 - Справочная ЖД  112 - Служба спасения ЧС  115 - Телефон доверия  116 - АО «Казахтелеком» прием телеграмм  144 - Телефон доверия финансовой полиции  150 - Телефон доверия детей и молодежи  165 - Централизованное бюро ремонта АО «Казахтелеком»  170 - Справочная кодов городов  188 - Справочная  1412 - Комитет таможенного контроля  1414 - Центр обслуживания населения  1415 - Телефон доверия бытового насилия (для женщин)  2040 - Защита прав потребителя  11616 - Телефон доверия торговли людьми  595 - Кассановабанк  7111 - Бтабанк  5030 - Сбербанк  9999 - Каспибанк  7722 - Евразийскийбанк  7575 - Альянсбанк  2424 - Атфбанк  5050 - Втббанк  7711 - Цеснабанк  7733 - Темiрбанк  7770 - Казакбанк  3311 - Азиякредитбанк  7888 - Рбкбанк  5757 - Дельтабанк  88000705705 - Позитивбанк  88000707007 - Фортебанк  88000800075 - Альфабанк  88000800900 - Нурбанк  88000800088 - Центербанк  88000800059 - Халыкбанк  88000800090 - Казкоммерцбанк  88000801880 - Жилстройбанк  88000800596 - Астанабанк  88000805559 - Банк развития Казахстана  88000801020 - Казахстанский фонд гарантирования депозитов  88000800600 - Страховая компания Альянс Полис  88000800099 - Страховая компания Евразия  7700 , 7799 - Samsung  2255 - LG  88000800303 - Планета электроники  88000808088 - Sulpak  88000800100 - Alser  88000805505 - Logycom  88000702011 - CocaCola  88000707070 - Hyundai  88000807775 - DaDa  88000801111 - Technodom  88000800880 - Kazpost  88000809809 - Panasonic  88000801008 - Газпром  88000802222 - КазМунайГаз  все номера бесплатные, кроме справочной. Будьте в курсе :)",http://vk.com/wall286741153_466
